{
  "domain": "wildlife-film-production",
  "version": 2,
  "sample_id": "092201-017",
  "record_types": [
    "事实访谈",
    "救助档案",
    "剧本场次",
    "人物授权",
    "取景许可",
    "生态影响评估",
    "拍摄许可",
    "拍摄通告",
    "拍摄素材",
    "审签记录",
    "发布版本"
  ],
  "workflow_states": [
    "资料核实",
    "剧本审签",
    "待拍摄",
    "摄制中",
    "剪辑中",
    "已发布",
    "变更复核"
  ],
  "facts": [
    "影片取材于受伤雪豹的真实救助经历",
    "故事聚焦一线生态管护人员",
    "摄制地点位于重要生态保护区域",
    "保护机构不公开栖息地精确坐标",
    "拍摄不得为画面再次干扰野生动物",
    "艺术改编处须标出与史实的边界"
  ],
  "roles": [
    {
      "id": "资料核实员",
      "duty": "核对事实访谈与救助档案，为剧本场次登记来源",
      "coordinate_access": "保护区分区"
    },
    {
      "id": "编剧",
      "duty": "撰写剧本场次，标注艺术改编与史实的边界",
      "coordinate_access": "县级"
    },
    {
      "id": "授权协调员",
      "duty": "取得并维护人物授权，处理当事人撤回",
      "coordinate_access": "县级"
    },
    {
      "id": "生态顾问",
      "duty": "开展生态影响评估，限定拍摄行为与干扰上限",
      "coordinate_access": "精确坐标"
    },
    {
      "id": "现场制片",
      "duty": "依据拍摄通告组织当日拍摄，核对允许进入的区域和行为",
      "coordinate_access": "精确坐标"
    },
    {
      "id": "剪辑师",
      "duty": "剪辑素材，保留关键情节可追查的来源依据",
      "coordinate_access": "县级"
    },
    {
      "id": "安全保管员",
      "duty": "保管敏感坐标与素材，处置疑似素材泄露",
      "coordinate_access": "精确坐标"
    },
    {
      "id": "发布负责人",
      "duty": "凭完整审签记录核查成片并批准发布",
      "coordinate_access": "县级"
    }
  ],
  "coordinate_levels": [
    "县级",
    "保护区分区",
    "精确坐标"
  ],
  "coordinate_rule": "敏感坐标仅向必要岗位开放，发布物料不得超出县级精度",
  "usage_constraints": {
    "人物授权": "限定相关人物的形象与姓名使用，当事人撤回后关联素材停用并进入复核",
    "取景许可": "限定可进入的取景区域与有效期",
    "生态影响评估": "限定拍摄行为与干扰上限，禁止为画面再次干扰野生动物",
    "拍摄许可": "限定素材的用途与传播范围"
  },
  "traceability": {
    "剧本场次": "登记来源（事实访谈或救助档案），改编处标注与史实的边界",
    "拍摄素材": "关联剧本场次，使用受人物授权、取景许可、生态影响评估与拍摄许可限定",
    "发布版本": "关键情节可沿剧本场次追查至来源记录"
  },
  "daily_confirmation": {
    "record": "拍摄通告",
    "timing": "每日开机前",
    "confirms": [
      "当天允许进入的区域",
      "当天允许的行为"
    ],
    "derived_from": [
      "取景许可",
      "生态影响评估",
      "拍摄许可",
      "保护区当日状态"
    ]
  },
  "change_triggers": [
    {
      "event": "剧本修改",
      "review": "剧本审签",
      "recheck": "受影响场次的来源登记与改编标记"
    },
    {
      "event": "当事人撤回授权",
      "review": "授权复核",
      "recheck": "关联人物授权、拍摄素材与剧本场次"
    },
    {
      "event": "保护区临时关闭",
      "review": "取景复核",
      "recheck": "取景许可、生态影响评估与拍摄通告"
    },
    {
      "event": "疑似素材泄露",
      "review": "素材安全复核",
      "recheck": "拍摄素材的保管与使用记录"
    },
    {
      "event": "海外翻译变化",
      "review": "发布审签",
      "recheck": "发布版本的表述与位置信息"
    }
  ],
  "release_checklist": [
    "成片未暴露栖息地精确位置",
    "救助过程未被歪曲",
    "素材使用未超出人物授权与许可范围",
    "艺术改编处均已标明与史实的边界",
    "关键情节均可沿剧本场次追查来源记录",
    "全部再审签已关闭"
  ],
  "sample": {
    "story_event": "雪豹康复观察样例",
    "location_precision": "县级",
    "permit": "ECO-FILM-026",
    "release_scope": "海内外传播",
    "scene": {
      "id": "SC-014",
      "sources": [
        "IV-003",
        "RA-002"
      ],
      "adaptation_marks": [
        "两次巡护合并为一次，改编处已标注"
      ]
    },
    "call_sheet": {
      "date": "2026-05-12",
      "allowed_zone": "B区东侧巡护道",
      "allowed_actions": [
        "定点隐蔽拍摄"
      ]
    },
    "approvals": [
      "AP-101",
      "AP-102"
    ]
  }
}
